[
  {
    "id": "base-fellowship",
    "summary": "DEADLINE: Black in AI Safety & Ethics (BASE) Fellowship",
    "month": 1,
    "day": 9,
    "description": "Focus: AI Safety, Ethics & Governance.\\nRequirements: CV, 1 referee contact, essay prompts.\\nPortal: https://airtable.com/app2G9C400ntVfMvm/pagWWSgzzn0NYBnNq/form"
  },
  {
    "id": "spar-ai",
    "summary": "DEADLINE: SPAR AI Risks Research Program",
    "month": 1,
    "day": 14,
    "description": "Focus: AI Safety & Alignment (Unpaid research program).\\nRequirements: Application form, technical background statement.\\nPortal: https://sparai.org/"
  },
  {
    "id": "danish-pruthi",
    "summary": "DEADLINE: Research Associate (Pre-doc) - Danish Pruthi Lab",
    "month": 1,
    "day": 15,
    "description": "Focus: NLP, Interpretability, Model Evaluation.\\nRequirements: CV, Academic Transcript, 1 referee contact, Motivation statement (250 words).\\nPortal: https://danishpruthi.com/"
  },
  {
    "id": "pibbss",
    "summary": "DEADLINE: PIBBSS Summer Research Fellowship",
    "month": 1,
    "day": 17,
    "description": "Focus: Complex Systems, Alignment, Biological & Artificial Intelligence.\\nRequirements: CV/Resume, Personal Statement, Past work/code samples.\\nPortal: https://princint.ai/programs/fellowship/"
  },
  {
    "id": "mats-summer",
    "summary": "DEADLINE: MATS Summer Cohort (ML Alignment & Theory)",
    "month": 1,
    "day": 18,
    "description": "Focus: Technical AI Alignment, Mechanistic Interpretability, RL.\\nRequirements: CV/Resume, 2 referee contacts, selection problems.\\nPortal: https://www.matsprogram.org/apply"
  },
  {
    "id": "vector-jan",
    "summary": "DEADLINE: Vector Institute Research Internship (Spring Cycle)",
    "month": 1,
    "day": 22,
    "description": "Focus: Deep Learning, Recommendation Systems, AI Theory.\\nRequirements: Academic Transcript, CV, Research Statement (optional for UG), 2 letters of recommendation.\\nPortal: https://vectorinstitute.ai/programs/research-internships/"
  },
  {
    "id": "rochester-chem",
    "summary": "DEADLINE: Univ. of Rochester Summer Research (i-Scholar)",
    "month": 1,
    "day": 23,
    "description": "Focus: Chemistry & Computational Sciences.\\nRequirements: CV, Academic Transcript, 2 referee contacts.\\nPortal: https://www.sas.rochester.edu/chm/undergraduate/i-scholar.html"
  },
  {
    "id": "cern-openlab",
    "summary": "DEADLINE: CERN OpenLab & Summer Student Programme",
    "month": 1,
    "day": 26,
    "description": "Focus: Large-scale Computing, Data Management, High-performance ML.\\nRequirements: Academic Transcript, CV, Motivation Letter, Reference Letters.\\nPortal: https://openlab.cern/cern-openlab-summer-student-programme/"
  },
  {
    "id": "asci-aalto",
    "summary": "DEADLINE: AScI Summer Research Programme (Aalto University)",
    "month": 1,
    "day": 31,
    "description": "Focus: Computer Science, Machine Learning, Data Science.\\nRequirements: Academic Transcript, CV, Motivation Letter, 1 Reference Letter.\\nPortal: https://www.aalto.fi/en/aalto-science-institute-asci/aalto-science-institute-international-summer-research-programme"
  },
  {
    "id": "desy-summer",
    "summary": "DEADLINE: DESY Summer Student Programme (Germany)",
    "month": 1,
    "day": 31,
    "description": "Focus: Scientific Computing, Data Pipelines, Acceleration & ML.\\nEligibility: Late Bachelor / Senior Undergrads.\\nBenefits: Daily allowance + free on-site hostel accommodation.\\nPortal: https://www.desy.de/"
  },
  {
    "id": "ista-internship",
    "summary": "DEADLINE: ISTA ISTernship Summer Program (Austria)",
    "month": 2,
    "day": 5,
    "description": "Focus: CS, Data Science, Machine Learning, Mathematical Foundations.\\nEligibility: Bachelor students completed >= 4 semesters.\\nBenefits: Fully funded monthly stipend, accommodation, travel support.\\nPortal: https://ista.ac.at/en/education/internships/"
  },
  {
    "id": "ucla-rips",
    "summary": "DEADLINE: IPAM RIPS Summer Research (UCLA / Singapore)",
    "month": 2,
    "day": 12,
    "description": "Focus: Applied Machine Learning, Data Analytics, Algorithms in Industry Projects.\\nEligibility: Undergraduates worldwide.\\nBenefits: Full travel, housing, and generous stipend.\\nPortal: https://www.ipam.ucla.edu/programs/student-research-programs/"
  },
  {
    "id": "edge-summer",
    "summary": "DEADLINE: EDGE Summer Program",
    "month": 2,
    "day": 13,
    "description": "Eligibility: Strictly for women with goals of attaining a PhD in mathematical sciences.\\nRequirements: Application form, CV/Resume, Transcript, 2 referee contacts.\\nPortal: https://www.edgeforwomen.org/summer-session/"
  },
  {
    "id": "cmu-lti",
    "summary": "DEADLINE: CMU LTI Language Technology for All Internship",
    "month": 2,
    "day": 20,
    "description": "Focus: NLP, Language Technologies, Representation Learning.\\nRequirements: CV, Academic Transcript, Short Answer Prompts.\\nPortal: https://lti.cmu.edu/news-and-events/news/2026-02-03-lt-for-all.html"
  },
  {
    "id": "google-africa",
    "summary": "DEADLINE: Google Research Africa Student Researcher",
    "month": 2,
    "day": 26,
    "description": "Focus: Machine Learning, African Language Tech, AI Systems.\\nRequirements: Academic Transcript, CV/Resume, Motivation Letter (apply ~1 month early).\\nPortal: https://www.google.com/about/careers/applications/jobs/results/93865849051325126-student-researcher/"
  },
  {
    "id": "ictp-diploma",
    "summary": "DEADLINE: ICTP Postgraduate Diploma Programme",
    "month": 2,
    "day": 28,
    "description": "Focus: Theoretical Physics and Mathematics.\\nRequirements: BSc or MSc, under age 28, Transcript, 2 recommendation letters, course certifications.\\nPortal: https://www.ictp.it/opportunity/ictp-postgraduate-diploma-programme"
  },
  {
    "id": "mbzuai-ugrip",
    "summary": "DEADLINE: MBZUAI UGRIP (Undergraduate Research Internship)",
    "month": 2,
    "day": 28,
    "description": "Focus: Machine Learning, NLP, Computer Vision.\\nEligibility: Penultimate year STEM undergraduate, CGPA >= 3.5/4.0.\\nRequirements: Academic Transcript, SOP, University Admission Letter, Passport.\\nPortal: https://mbzuai.ac.ae/ugrip/"
  },
  {
    "id": "caltech-surf",
    "summary": "DEADLINE: Caltech SURF (Summer Undergraduate Research)",
    "month": 3,
    "day": 1,
    "description": "Focus: Fundamental Computing, Applied AI, Algorithms.\\nRequirements: Contact Caltech faculty mentor in fall, research proposal, 2 recommendation letters.\\nPortal: https://sfp.caltech.edu/undergraduate-research/programs/surf"
  },
  {
    "id": "insait-surf",
    "summary": "DEADLINE: INSAIT SURF Summer Research (Bulgaria / ETH / EPFL Network)",
    "month": 3,
    "day": 8,
    "description": "Focus: Foundation Models, Machine Learning, Systems, Theory.\\nEligibility: Undergraduates worldwide, Min GPA 3.5/4.0.\\nBenefits: €1,500/month stipend, accommodation, and travel covered.\\nRequirements: CV, Transcript, 1-page motivation letter.\\nPortal: https://insait.ai/surf/"
  },
  {
    "id": "reneu-uchicago",
    "summary": "DEADLINE: RENEU - UChicago (Nigerian Undergrads)",
    "month": 3,
    "day": 9,
    "description": "Focus: Materials Science, ChemE, Energy & ML.\\nEligibility: 4th/5th year Nigerian Undergrads intending to pursue PhD; First Class or 2:1 track.\\nRequirements: CV, Academic Transcript, Statement.\\nPortal: https://amanchukwu.uchicago.edu/outreach/researchexperience/"
  },
  {
    "id": "lasr-labs",
    "summary": "DEADLINE: LASR Labs Summer Internship",
    "month": 3,
    "day": 30,
    "description": "Focus: AI Safety, Security, Governance.\\nRequirements: Essay responses, CV/Resume.\\nPortal: https://www.lasrlabs.org/"
  },
  {
    "id": "mak-ai",
    "summary": "DEADLINE: Mak-AI Undergraduate Internship Program",
    "month": 4,
    "day": 3,
    "description": "Focus: Applied Machine Learning, Edge AI, African Context Solutions.\\nRequirements: CV, Academic Transcript, Statement.\\nPortal: https://air.ug/?page_id=1819"
  },
  {
    "id": "cambridge-era",
    "summary": "DEADLINE: Cambridge ERA:AI Summer Fellowship",
    "month": 4,
    "day": 12,
    "description": "Focus: Existential Risk, Technical AI Alignment, Policy.\\nRequirements: Essay questions, 2 referee contacts.\\nPortal: https://erafellowship.org/"
  },
  {
    "id": "elite-lab",
    "summary": "DEADLINE: ELITE Research Lab Internship",
    "month": 4,
    "day": 15,
    "description": "Tracks: CS Research Intern, Economics & Business Research.\\nRequirements: Short answer prompts, CV.\\nPortal: https://lnkd.in/g97jvByR"
  },
  {
    "id": "ljla-lagos",
    "summary": "DEADLINE: Lateef Jakande Leadership Academy (LJLA) Fellowship",
    "month": 5,
    "day": 16,
    "description": "Post-graduation Target: 1-year public sector leadership.\\nEligibility: Nigerian, 25-35 yrs, Bachelor/HND, NYSC complete + 2 yrs work exp.\\nPortal: https://www.ljla.academy/application2026/"
  },
  {
    "id": "rbc-borealis",
    "summary": "DEADLINE: RBC Borealis ML Research Internship",
    "month": 5,
    "day": 17,
    "description": "Focus: Applied Machine Learning, RecSys, NLP.\\nEligibility: Graduate students (MSc/PhD).\\nRequirements: Resume/CV, Research portfolio.\\nPortal: https://rbcborealis.com/internships/"
  },
  {
    "id": "vector-fall",
    "summary": "DEADLINE: Vector Institute Internship (Fall Intake)",
    "month": 5,
    "day": 19,
    "description": "Focus: Machine Learning, Recommenders, Deep Learning.\\nRequirements: CV, Academic Transcript, Research statement (250-400 words), 2 referees.\\nPortal: https://vectorinstitute.ai/research-talent/students/ai-research-internships/"
  },
  {
    "id": "illumina-lab",
    "summary": "DEADLINE: Illumina Health Lab Internship",
    "month": 6,
    "day": 1,